ammuvainaan nuotilla ,"epäpuhtaasti, nuotin vierestä   ",Jotkut humalaiset mölis ja laulo ammuvainaan nuotilla. Pappi veisas kovaa mutta ihan ammuvainaan nuotilla. ,out of tune
ampua lonkalta ,"ampua nopeasti, tähtäämättä lonkan korkeudelta  ","Älä tähtää, ku ammu vaan lonkalta! ",shoot from the hip
ampua yli ,"liioitella, mennä liian pitkälle ","Musta noi eläintensuojelijat ampuu vähän yli. Äikänope sano, et mä ammuin yli siinä aineessa. ",overdo
antaa ,"suostua sukupuoliyhdyntään, antaa naida  ","Anna nyt mulle! Annoiks sä siljätkälle? Sejätkä ei oo antanu viikkoon, ",to consent to sex
antaa hanaa ,"kaasuttaa, ajaa kovaa, mennä kovaa  ","slg. Heti ku päästiin moottoritielle, mä annoin hanaa. Annas hanaa, etpäästään ohi tosta traktorista! ","""step on it"""
antaa heittää ,"mene tiehesi, häivy, ala vetää, antaa vetää  ","Hei sä siellä, antaa heittää vaan pihalle siitä! ","""Get off!"""
antaa huutia ,"nuhdella, torua  ","Poliisit anto meille huutia, ku pyörässä ei ollu valoja. Kyllä mä annan huutia niille puhelinmyyjille. ",rebuke
antaa kenkää ,"erottaa työsuhteesta, potkia pois jostakin, lopettaa seurustelu ","Sille juopolle annettiin lopulta kenkää. Valmentaja antaa kenkää, jos ei käy treeneissä. Niina anto kenkää sille jätkälle. ","dismiss, fire, leave sb"
antaa kyytiä ,"ajaa tiehensä, karkottaa; lyödä, antaa selkään, voittaa ylivoimaisesti  ",Nyt pitää mennä tai noi vartijat antaa meille kyytiä. Suomi anto Ruotsille kyytiä lätkän MM-kisoissa. ,drive (sb) off; beat
antaa liekaa ,"antaa jollekin vapauksia, mahdollisuuksia  ","Heti ku mä annan sille lapselle vähänkin liekaa, se menee ihan mahottomaks. Nyt on tässä pelissä niin kova vastustaja, et liekaa ei voi antaa yhtään. ","allow liberties, give a chance"
antaa mennä ,"huolettomana kehotuksena: siitä vaan, olkoon, antaa palaa  ","""Otetaanko vielä yhet? - Antaa mennä!"" ""Joko mä painan ? - Anna mennä!"" ","""Go ahead!"""
antaa olla ,"ärtyneenä kehotuksena: riittää, lopeta jo, älä tee mitään  ","Antaa olla, mua ottaa päähän koko touhu. ""Ymmärrätkö sä? - Joo joo, anna olla jo!"" ","""Leave it!"""
antaa palaa ,"huolettomana, riehakkaana kehotuksena: siitä vaan, antaa mennä  ","""Tuleeks sielt ketään ? - Ei tuu, antaa palaa vaan!"" Anna palaa, äläkä mieti turhia! ","""Go ahead""!"
antaa palttua ,olla välittämättä jostakin  ,"Älä välitä sen jätkän jutuista, anna palttua vaan. Mä annoin palttua koko jutulle, ",to not care
antaa pitkät ,"olla välittämättä jostakin, suuttua, haistattaa pitkät  ","Tommoselle nuijalle mä annan pitkät. Joskus tekis mieli antaa vaan pitkät kaikille, ",to not care
antaa piupaut ,olla välittämättä jostakin  ,Isä aina vaan huutaa ja mun mielipiteille se antaa piupaut. Tänään mä lepään ja annan piupaut kaikille kotihommille. ,to not care
antaa soittaa ,"huolettomana, riehakkaana kehotuksena: siitä vaan, antaa palaa  ","Antaa soittaa vaan, tie on tyhjä! ","""Go ahead!"""
antaa tulla ,"uhmakkaana kehotuksena, kun toinen haluaa tehdä tai sanoa jotakin: siitä vaan, voit toimia, olen valmis vastaamaan  ","""Haluuks sä turpaas ? - Antaa tulla vaan! "" ""Mulla olis sulle yks juttu. -No, anna tulla!"" ","(defiantly) ""Come on!""; ""Yes?"""
antaa vetää ,"mene tiehesi, häivy, ala vetää, antaa heittää  ",Antaa vetää niin kuin olis jo! ,"""Get off!"""
aparaatti ,"laite, koje, vehje  ","Tää on aika hieno aparaatti, tää uus videokamera. ",machine
apinoida ,"matkia, jäljitellä  ","halv. Villen pikkuveli aina apinoi sitä. Onks sitä pakko apinoida, jos joku tekee tyhmyyksiä? ",imitate
apostolinkyydillä ,"jalan, jalkapatikassa, kävellen  ","Ei sinne oo tietä, pitää mennä apostolinkyydillä. ",on foot
apro ,approbatur: ylioppilaskokeen alin hyväksytty arvosana; perusopinnot yliopistossa   ,"Niina pelkää, että se saa ruotsista apron. Mä oon tehny kasvatustieteiden apron avoimessa yliopistossa, ",lowest pass grade in high school final exams; basic studies at university
apukuski ,"kuljettajan vieressä istuva matkustaja, hanttimies  ","Apukuskin puolella oli iso lommo. Turvaistuimen voi panna taakse tai sit eteen apukuskin paikalle, ",person sitting next to the driver
armoton ,"vahvistussana: mahtava, huikea; hirveä, kauhea  ",Bileissä oli armoton meininki. Jätkällä kävi armottoman hyvä tuuri. Mua väsytti aamulla ihan armottomasti. Villellä oli armoton krapula. ,intensifying word>
arska ,aurinko  ,slg. Paistaaks siel arska ? Maattiin rannalla ja otettiin arskaa. ,sun
arvata ,"uskaltaa, tohtia  ","Arvaako sitä lähtee mihinkään, ku on tommonen ilma. Se oli niin vihasen näkönen, et mä en arvannu kysyä mitään, ","bother, dare"
aseet ,"ruokailuvälineet, aterimet, syömäaseet  ","Onks täällä aseet missä? Vähän hankala syödä, ku ei oo aseita, ",cutlery
asetukset ,tietokoneohjelmaan asetetut tiedot  ,Miten nää asetukset saa muutetuksi? Älä koske niihin asetuksiin! ,default settings
asevelihinta ,"halpa hinta, sopuhinta, varsinkin tuttavien kesken  ","Sata euroo, ja se on asevelihinta. Mä sain sen auton asevelihintaan. ",low price
asfaltti-ihottuma ,"ihovamma, joka syntyy tielle kaatumisesta  ","Onneks ei tullu ku vähän asfalttiihottumaa, ",scratches on skin after falling on asphalt
aski ,"rasia, laatikko, pakkaus  ","Paljon tupakka-aski maksaa nykyään ? Ne karkit on semmosessa punasessa askissa, ","packet, pack"
assa ,(rautatie)asema  ,Assalla on paljon epämäärästä porukkaa. ,station
assari ,assistentti yliopistossa  ,"Sit ku valmistuu, voi jäädä yliopistolle assariks. ",assistent (at university)
astua korkin päälle ,olla (vähän) humalassa  ,Oot tainnu vähän astua korkin päälle. Sit siihen tuli joku korkin päälle astunu äijä selittämään. ,be (slightly) drunk
atomeiksi ,"hajalle, rikki, osiksi  ",Villen lasi putos lattialle ja meni ihan atomeiks. Se kivi räjäytettiin atomeiks. Toi moottori pitää purkaa atomeiks. ,broken to pieces
auki ,"rahaton, varaton; velkaa  ","Palkka tulee vasta viikon päästä, ja mä oon ihan auki. Voisitko sä nyt maksaa sen kympin, minkä sä oot auki mulle ? Niina jäi mulle kakskymppiä auki, kun me oltiin baarissa. ",without money; owe money
aukoa päätään ,"puhua paljon, ärsyttää, valittaa, soittaa suuta  ","sig. Älä auo päätäs mulle! Aina toi jätkä aukoo päätään joka paikassa. Naapurin äijä tuli aukomaan päätään, että me soitetaan stereoita liian lujaa, ","complain, talk arrogantly"
aussi ,australialainen  ,Aussit on hyviä uimaan. ,Australian
aut ,"pois muodista, vanha juttu  ","slg. Etsä tajuu, sähän oot ihan aut! Se juttu onjo aut. ",outdated
autuaasti ,"tahattomasti, pahaa-aa- vistamatta  ","Mä olin unohtanu autuaasti koko asian. Me nukuttiin autuaasti pommiin, ","unintentionally, unsuspectingly"
baana ,"(leveä) katu, tie, väylä  ","slg. Se on hyvä baana, voi ajaa satasta koko matkan, ",road
baanalla ,"juhlimassa, ulkona, kaupungilla, liikenteessä  ","slg. Paa takki niskaan, niin lähdetään baanalle! Vähän väsyttää, kun mä olin koko yön baanalla. ",out (partying)
baarimikko ,"baarimestari, viinuri  ","Mä kysyn baarimikolta, mikä olis oikein hyvä paukku. Mä oon nähny ton jätkän, se on jossain baarimikkona. ",bartender
bailata ,"juhlia, tanssia  ","slg. Me bailattiin koko yö. Ville on kova jätkä bailaamaan, ",to party
bailut ,"juhlat, bileet ",slg. Oli tosi rajut bailut. Lähetkö sä sinne bailuihin? ,party
bansku ,banaani  ,"Banskut makso vaan euron kilo. Meill oli banskuja eväänä, ",banana
basilli ,"bakteeri, taudinaiheuttaja  ","Mulla on kauhee nuha, kai se on joku basilli. Päiväkodistahan ne tarttuu kaikki basillit, ",pathogen
biitti ,"rytmi, komppi  ","slg. Mennään tanssimaan, nyt on hyvä biitti! ","beat, rhythm"
biitti ,pala jotain ainetta; nuuskamälli ,"slg. Lätkänpelaajilla on aina biitti huulessa, ","bit, quid (of snuff)"
beesi ,"beige, peesi ","Niina osti beesin värisen takin, ",beige
beibi ,"kulta, kulti, rakas, hani  ","Voi beibi, mullon ollu sua ihan kauhee ikävä. Nyt mun on ihan pakko soittaa beibille, ","honey, darling"
Bemari ,BMW-merkkinen auto tai moottoripyörä  ,Naapuri oli ostanu uuden Bemarin. Bemarit aina kaahaa liikenteessä. Poliisien prätkät on enimmäkseen Bemareita. ,BMW
bensa ,bensiini  ,Autosta loppu bensa. Pitäs käydä ostamassa bensaa. ,"petrol, gasoline"
bestikset ,parhaat (tyttö)ystävykset  ,"slg. Laura ja Niina on bestikset. Me oltiin vielä kasiluokalla bestiksiä, mut sit se jotenkin loppu. ",bestfriends
bestis ,(tytön) paras ystävä  ,slg. Laura on Niinan bestis. Voinks mä ottaa mun bestiksen mukaan ? ,best friend
betoniporsas ,betonista tehty ajoeste  ,"Ei tost pääse ajamaan, sinne on pantu betoniporsaat, ",concrete bollard
biisi ,"musiikkikappale, sävelmä, piisi ","Tiedätkö sä, mikä biisi tää on ? Bändi soittaa vain vanhoja biisejä, ",song
biitsi ,uimaranta ,slg. Thaimaassa on hyvät biitsit. Mennään löhöömään biitsille. ,beach
bikata ,käydä aerobicissä ,Mii salil sä bikkaat? Niina on bikkaamassa. ,do aerobics
bikki ,aerobic ,Mulla on tänään bikkitunti. Niina harrastaa bikkiä. ,aerobics
bileet ,"juhlat, bailut ","Niina pitää bileet, kun niiden porukat lähtee mökille. Bileissä ei ollu mitään juomista, ",party
bilettää ,"juhlia, käydä bileissä  ","Kun kirjotukset on ohi, sitten mä biletänja kunnolla. Lähetään kaupungille bilettämään! ",to party
bilsa ,biologia oppiaineena  ,Meillä on huomenna bilsan kokeet. Se lukeebilsaayliopistossa. ,Biology(as subject)
bimbo ,"tyhmä, hölmö; pinnallinen nainen  ",halv. Tota bimboo ei kiinnosta muu ku meikit ja vaatteet. Villen kaikki tyttöystävät on ollu ihan bimboja. ,bimbo
bingo ,"huudahdus, jota käytetään, kun joku keksii jotakin, arvaa oikein tms.; täysosuma  ","Mä löin vetoo, et se peli päättyy 2—4, ja - bingo! ","""Bingo!"""
bisnes ,"kaupankäynti, liiketoiminta  ",Nykyään urheilu on pelkkää bisnestä. Ville tuhlas rahat johkin epämääräsiin bisneksiin. ,business
"bisse, bise, bisoshooffen ",olut  ,slg. Mä voisin ottaa yhen bissen. Sikspäkissä on kuus bisee. Lähetään bisselle! Onks siellä jääkaapissa yhtään bisoshoojfenia? ,beer
bittinikkari ,"tietokoneiden asiantuntija, innokas harrastaja  ",Toi pikkujätkä on kauhee bittinikkari. Bittinikkareille löytyy helposti töitä. ,computer expert
blandata ,"sekoittaa juomia, laimentaa alkoholia, lantrata  ",Kossua voi blandata vaikka tuoremehulla. Millä sä oot oikein blandannu tätä? ,"mix, dilute"
blandis ,"neste, jolla alkoholijuomia laimennetaan, lantrinki ","slg. Kokis on hyvä blandis. Ei ollu blandis ta, piti juoda raakana. ",diluting substance
blokata ,"estää, sulkea; urheilussa: estää vastapuolen pelaajan kulkua  ","Poliisi blokkas tien. Meidän puolustajat ei pystyny blokkaamaan ruotsalaisia, ja ne teki maalin.",to block
blondi 1 ,vaaleatukkainen  ,Onks sun tukka värjätty vai ootko sä oikeesti blondi? ,blonde
blondi ,"tyhmä, pinnallinen nainen, bimbo  ","halv. Ei tommosia ohjelmia kato muut ku jotkut aivottomat blondit, ",bimbo
bodari ,"kehonrakentaja; lihaksikas, isokokoinen mies  ","Schwarzenegger oli ensiks bodari, sit vasta näyttelijä. Ei sinne salille kehtaa mennä, ku siellon vaan kauheita bodareita. ",body-builder
bodata ,"harrastaa kehonrakennusta, käydä kuntosalilla ","Kannattas vähän bodata, että saa lihaksia. Monta kertaa viikossa sä käyt bodaamassa? ",dobody-building
boltsi , pallo; pää  ,slg. Pikkujätkät heitteli boltsia pihalla. Tolia naapurin äijällä on boltsi ihan sekosin. ,"ball, head"
bongata ,"tavata, löytää, huomata; erit. tehdä havaintoja linnuista  ","Kasinolla on hyvä bongata julkkiksia. Niina bongas tosi komeen jätkän yheitä terassilta. Suomessa on taas bongattu uus lintulaji, ","to notice, find; to bird watch"
bootsit ,"(cowboy)saappaat, buutsit  ",Nää bootsit pitäs viedä pikasuutarille. ,cowboy boots
bosat ,rinnat  ,"slg. Näätkö sä, mitkä bosat tolia muijalla on! Eikö miehiä muu kiinnosta, ku et pitää olla isot bosat? ",breasts
botski ,"vene, laiva  ","slg. Pitäis laskee botski vesille. Kesällä on kiva olla botskilla. Nykyään botskit menee Tallinnaan tosi nopeesti, ",boat
"brassailla, brassata ","teeskennellä, kerskailla, leveillä  ","slg. Noi yliopistotyypit aina brassailee sivistyssanoilla. Ei sil mitään rahaa oo, se brassaa vaan. Naapurin äijä brassas uudella Bemarillaan. ",show off
brassi ,brasialainen  ,Brassit voitti jalkapallon MM-kisat. ,Brazilian
breikata ,tehdä läpimurto (musiikkibisneksessä)  ,Suomalaisten bändien on vaikee breikata ulkomailla. Tämmönen musa ei breikkaa kyllä ikinä. Vasta kolmas levy breikkas. ,to break through (in music business)
breikki 1 ,tauko ,"slg. Eiköhän pidetä pieni breikki. Bändi jatkaa soittamista breikinjälkeen, ",pause
breikki ," break dance, tanssi joka perustuu vaikeaan akrobatiaan  ",slg. Toi breikki on mulle kyllä ihan liian vaikeeta. Niina osaa vähän breikkiä. ,break dance
brenkku ,"viina, alkoholi  ",slg. Brenkku meni nopeesti päähän. Ootko sä taas ottanut brenkkua ? ,alcohol
briiffata ,"antaa (lyhyt) tilannekatsaus, ohjata, neuvoa  ","slg. Voisitko sä briiffata vähän, mitä siellä puhuttiin? Valmentaja vielä briijfas meitä ennen peliä, ",to brief
broidi ,veli  ,"slg. Villellä on yks broidi ja yks systeri. Tänään on mun pikkubroidin synttärit, ",brother
bumerangina ,"hakemuksesta, ehdotuksesta tms., kun se palautetaan tai muuten hylätään nopeasti.  ","Onks sul vaihtunu osote, ku kaikki meilit tulee bumerangina takasin ? Kustantaja lähetti mun kässärin bumerangina. Mä sain sen hakemuksen bumerangina takasin. ",returned quickly
buukata ,varata tai tilata etukäteen  ,"Mä buukkasin jo matkan talvilomaks. Koko hotelli oli buukattu täyteen, ",to book
buumi ,"taloudellinen nousukausi; äkillinen suosion nousu, innostus  ","Asuntojen hinnat nousee koko ajan, ku on tämmönen buumi. Kännykkäbuumi taitaa olla jo menny ohi. Lumikengillä kävely on nyt oikee buumi, ",boom
buutsit ,cowboy-saappaat  ,"Onpas sulia makeet buutsit. Buutseilla on ihan mahoton kävellä liukkaalla kelillä, ",cowboy boots
bylsiä ,"naida, rakastella, nussia  ","slg. Kukaan ei päässv vessaan, ku yhet bylsi siellä. Ootsä muka bylsiny sen kanssa ? ",have sex
bändi ,"yhtye, orkesteri  ",Bändi soitti vanhaa rokkia. Ootko sä jossain bändissä? Mä en jaksa kuunnella näitä nykysiä hip hop -bändejä yhtään. ,band
"bänksit, bänät ",seurustelun lopettamisesta  ,Ville teki bänksit Lissun kanssa. Nyt tuut äkkiä kotiin tai tulee bänksit! Meille tuli bänät. ,breaking up (a relationship)
daiju ,"tyhmä, yksinkertainen  ",slg. Ootsä ihan daiju ? Mä en kestä tommosia daijuja. ,stupid
daijuun ,"lyömisestä, selkään antamisesta: kuonoon, naamaan, turpaan  ","slg. Älä mee sinne, saat vielä daijuun. Nyt tulee jätkä daijuun! ",beaten up
darra ,krapula  ,"slg. Mulle tulee punkusta kauhee darra. Siltä meni kortti, ku se ajo autoo darrassa. ",hangover
deejii ,"DJ, tiskijukka  ",Deejii soitti teknoo koko illan. Ville yritti päästä siihen diskoon deejiiks. ,"disc jockey, DJ"
deekikseilä ,"rappiolla, alkoholisoituneena; alkoholisoitunut, masentunut  ","Kyllä mä joskus otan, mutta en mä nyt sentään missään deekikseilä oo. Kun se jäi työttömäks, se joutu deekikselle. Se on menny ihan deekikselle. ","addicted to alcohol, degenerated"
deeku ,"juoppo, rappioalkoholisti, pultsari  ","Deekut juo vaikka tuulilasinpesuainetta. Sit siihen tuli joku deeku äijä selittämään, ",an alcoholic
deitti ,"sovittu tapaaminen, treffit; (satunnainen) seurustelukumppani; seuranhakuun tarkoitettu Internet palvelu, TV-ohjelma tms.  ","Mulla on tänään deitti Villen kanssa. Mihin te meinaatte mennä deiteillä? Ei se mikään poikaystävä oo, se oli vaan deitti. Ne on kuulemma tutustunu jossain deitissä. Telkkarista tulee tota deittiä ihan älyttömästi, ",date; date site
delata ,kuolla  ,"slg. Mua hävetti niin paljon, et mä öisin voinu vaikka delata siihen. Se kukka delas ku en mä muistanu kastella sitä. Mun isoisä on delannu sodassa, ",die
demari ,sosiaalidemokraatti  ,Mun isä on demari henkeen ja vereen. Demarit voitti vaalit. Valtuustossa on puolet demareita ja puolet kepulaisia. ,a Social Democrat
depis ,"depressio, masennus  ","Niinalla on kauhee depis, ku ruotsin kokeet meni huonosti. Mä oon aina syksyllä ihan depiksessä. ",depression
devari ,DVD-soitin tai levy  ,"Ei kukaan enää osta videonauhureita, ku pitää olla devari. Tällä devarilla on paljon uutta matskua. ","DVD, DVD player"
digata ,"pitää jostakin, tykätä, välittää ",slg. Mä en diggaa hiphoppia yhtään. Diggasitko sä tosiaan siit muijasta ? Pennut diggaa pelata tietokoneella vaikka koko yön. ,to like
diileri  ,"(jonkin tuotteen) jakaja, jakelija, jälleenmyyjä; valuuttatai osakekauppias ","Kannattaa ostaa suoraan maahantuojalta eikä miltään ihme diilereiltä. Diileri jako mulle hyvät kortit. Kai siilon rahaa, ku se on joku pörssidiileri. ",dealer
diileri ,huumeiden välittäjä  ,slg. Assan kulmilla pyörii aina diilereitä. ,drug dealer
diili ,(kauppa)sopimus  ,"Meidän bändi sai diilin levy-yhtiön kanssa. Noitten uusien firmojen kanssa voi tehdä hyviä diilejä. Miten olis semmonen diili, et mä tiskaan ja sä imuroit? ",deal
dipata ,upottaa ruokaa (sormin) kastikkeeseen; syödä dippaamalla  ,"Sipsejä voi dipata vaikka kermaviiliin. Lihat grillataan ensiks ja sit dipataan soijakastikkeessa. Ne dippas ja joi kokista, ",dip
dippi ,"kastike, johon ruokaa dipataan  ",Jugurtista ja ranskankermasta saa hyvän dipin. ,dip sauce
diskata ,"diskvalifioida, hylätä kilpailusta tms.  ","Tuomari diskas maalin. Mut diskattiin sataselta, ku mä varastin kaks kertaa. Suomalaisia hiihtäjiä on diskattu paljon dopingin takia, ",disqualify
divari ,"ostoja myyntiliike, antikvariaatti  ","Pitäs viedä noi vanhat kirjat divariin. Mä tykkään käydä divareissa, ku niistä saa vinyylilevyjä. ",second-hand shop
divari ,divisioona urheilussa ,Ville pelaa fudista nelosdivarissa. Joukkue tippu pääsarjasta divariin. ,division (in sports)
dokata ,"ryypätä, juopotella  ",slg. Mä dokaan kyllä melkein joka viikonloppu. Niina dokaa aina siideriä. Monta päivää te oikein ootte dokannu? ,drink alcohol
doku ,"juoppo, alkoholisti  ","slg. Toi äijä on täys doku. Portsari ei päästä dokuja sisään, ",an alcoholic
donitsi ,"lenkki, jolla hiukset kiinnitetään poninhännälle tai saparolle, ponnari  ",Niinalla oli irtoletti ja hieno donitsi. Ei tommosia pinkkejä donitseja käytä enää kukaan. ,pony-tail donut
dorka ,"hullu, tyhmä; ikävä, tylsä, vastenmielinen  ","slg. Se on niin dorka, ettei se kelvannu ees armeijaan. Meiän naapuri on ihan dorka. On dorkaa ajaa kännissä. Dorkaa vaan istua sisällä, ku on näin hieno ilma. ",crazy; stupid; boring
doupata ,"käyttää tai antaa dopingaineita, syyllistyä dopingiin; käyttää huumaavia aineita  ","Kyllä urheilijat douppaa joka maassa. Hiihtäjä jäi kiinni testeissä, kun se oli doupattu. Kaikki douppas siellä bileissä, ",todope
douppi ,"doping-aine, huumaava aine  ",Voi sitä kilpailussa pärjätä ilman douppiakin. Tunnetko sä jonkun doupin myyjän ? ,dope
dubata ,"äänittää elokuva tai video uudestaan toisella kielellä, jälkiäänittää ","Saksalaiset dubbaa kaikki ohjelmat. Tää video on dubattu suomeks, ku se on tarkotettu lapsille. ",to dub
dulla ,"hasis, kannabis, pilvi, ruoho  ","slg. Dulla on ihan eri asia ku jotkut kovat huumeet. Jengi joi kaljaa ja veti dullaa, ",hashish
dumari ,(urheilu)tuomari  ,"slg. Dumari meinas pilata matsin, ku se vihels jäähyjä koko ajan. ","referee, umpire"
dunkkis ,"haju, löyhkä  ",slg. Mikä ihmeen dunkkis täällä on? Tosta valkosipulista tulee kauhee dunkkis. ,smell
duunari ,"työntekijä, työläinen  ","Ei se oo ku tavallinen duunari. Kohta ei oo kunnon duunareita ollenkaan, ku kaikki haluu vaan mennä lukioon. ",worker
duunata ,"tehdä työtä, olla töissä; hommata, puuhailla; tehdä, valmistaa, korjata jotakin  ","Tiedäks sä mitä sen Niinan faija duunaa, ku niillä on niin hieno kämppä? Duunataan jotain hauskaa viikonloppuna. Mä duunasin itte kirjahyllyn. Aina se jaksaa duunata tota autoo. ","do, make"
duuni ,"työ, työpaikka; työ, homma, tehtävä  ","Mis sä oot duunissa ? Pitäs saada joku duuni kesäks. Mun pitää mennä kuudeks duuniin. Omakotitalossa on aina kaikkee pikku duunia. Toi mattojen pesu on kauhee duuni, ",job
dyykkari ,"ihminen, joka etsii roskasäiliöistä ruokaa, vaatteita tms. köyhyyden tai periaatteen vuoksi  ",Meidän roskiksessa on taas nukkunu joku dyykkari. Dyykkarit hakee ruokaa kauppojen roskiksista. ,dumpster diver
dödö ,deodorantti  ,"On vissiin dödö pettäny, ku kainalot on ihan märät. Voi harmi, mä unohdin ottaa dödön mukaan, ",deodorant
dösä ,bussi  ,"slg. Vika dösä lähtee kakskolme nelkytviis. Me ootettiin dösää melkein tunti. Lähetään puol kahen dösällä, ",bus
"eellä, eeitä, eelie ","edellä, edeltä, edelle  ","Mun kello on viis minuuttia eellä. Uskallatko sä hypätä viidestä metristä pää eellä? Aja sä vaan eeltä, me tullaan kohta perässä. Saisinks mä mennä teiän eelle, mullon vähän kiire? ","before, ahead, first"
eepilieri ,"ehkäisytabletti, -pilleri  ",Eepillereihin täytyy olla resepti. Käytäks sä eepillereitä? ,contraceptive pill
ees ,edes  ,"Ootetaan nyt ees viis minuuttia. Ei se sanonu mitään, ei ees kiittäny. ","at least, (not) even"
"eessä, eestä ","edessä, edestä [in/ (the) ",Niina istuu tuolla ihan eessä. Siinähän se avain on nenäs eessä. Mee pois telkkarin eestä! Mun pitäs lyhentää tukkaa vähän tost eestä. from front] ,in/ from (the) front
eestakas(in) ,edestakaisin  ,Mitä sä ravaat siin eestakasin? Ville ajeli koko yön eestakas kaupungilla. ,back and forth
ee vee vee koo ,"EVVK, ei voisi vähempää kiinnostaa  ","No kyllä oli taas semmonen luento, että ee vee vee koo. ""Ja kotiin sitten viimestään kaheltatoista! - Ee vee vee koo!"" ",couldn't care less
ege ,"euro, erkki, jörö  ","slg. ""Paljon se maksaa? - Viis egee."" Ei kymmenellä egellä saa yhtään mitään. ",euro
ehdoton ,"erittäin hyvä, erinomainen, suurenmoinen  ","Tää on ehdoton biisi! Ville on ihan ehoton tyyppi. iMskettelu on talvella ehdotonta hommaa. Nää kengät on reissussa ihan ehdottomat, ",very good
ehta ,"hyvä, aito, oikea  ",Onks toi kello ehta vai joku kopio? Kossu on ehtaa tavaraa. Bändi soitti ehtaa rokkia eikä mitään diskopaskaa. ,genuine
ei ala mitään ,varsinkin lasten puheessa kyllästymisestä tai harmistumisesta: ei haluta tehdä mitään  ,"Mä en ala mitään, jos en saa olla ekana. Ai sä et nyt taas ala mitään? Me ei aleta mitään, ku siel sataa, ",not willing to do anything or to join in
ei ensimmäistäkään ,"ei yhtään, yhtäkään, ainuttakaan  ","Siin porukas ei oo ensimmäistäkään täysjärkistä ihmistä. Mä oon lähettäny varmaan viiskyt hakemusta, mut en mä oo saanu ensimmäistäkään vastausta, ","no, none"
ei erkkikään ,"ei kukaan, ilmaisee ettäjokin on täysin mahdotonta tai sietämätöntä  ","Pane se radio kiinni, eihän tota kuuntele erkkikään! Eihän tämmöstä muussia erkkikään syö. Sataa kiloa ei nosta vanha erkkikään. Sun käsialasta ei ota naapurin erkkikään selvää. ",impossible for anyone
ei ihme ,"vastauksena toisen puheeseen: kyllähän sen tiesi, se oli odotettavissa  ","""Munfillari varastettiin eilen. - Ei ihme, ku ethän sä koskaan pitäny sitä lukossa."" ",no wonder
ei juuta ei(kä) jaata ,"ei ole puolesta eikä vastaan, ei mitään mieltä, ei tarkoita mitään  ","En mä osaa sanoo siihen juuta enkä jaata. Ei se vastannu juuta eijaata. Tommonen tulos ei vielä meinaa juuta eikäjaata, ","noopinion,(mean) nothing"
ei kai  ,"lauseen alussa ilmaisee epätietoisuutta, epäröintiä, epäilevää suhtautumista tai vähättelyä oo. ","Ei kai tota koko kirjaa tartte lukea? Ei kai toi oo Ville, toi tuolla kaukana ? Et kai sä aio lähtee enää ulos? Ei kai sil mitään väliä ","(as negative tag questions) ""It's not...is it?"", etc."
ei kai ," vastauksena toisen puheeseen ilmaisee myötätuntoista ihmettelyä: sepä ikävää, onpa harmi  ","""Voi hitsi, mä unohin avaimet kotiin! - Ei kai! "" ",used when expressing empathy and surprise
"ei kauaa, kauan nokka tuhise ","ei kestä kauan, ei viivytellä, ei mene aikaa  ","No siinei kauaa nokka tuhise, kun mä ton lampun vaihdan. Tommosen homman kanssa ei kauan nokka tuhise. Niinalla ei nokka kauaa tuhissu, ku se oli jo valmis, ",won't take long
